{
  "$schema": "https://schema.openakb.org/v1/openakb.schema.json",
  "id": "valid-single",
  "title": "Valid — single section",
  "description": "One root content section with a source; the floor of validity.",
  "tags": ["fixtures", "single_section"],
  "sources": [
    {
      "id": "SRC-000001",
      "type": "url",
      "uri": "https://docs.example.com/a/"
    }
  ],
  "sections": [
    {
      "id": "SEC-000001",
      "title": "Root",
      "description": "The only section.",
      "content_uri": "root.md",
      "source_ids": ["SRC-000001"]
    }
  ]
}
