{
  "$schema": "https://schema.openakb.org/v1/openakb.schema.json",
  "id": "removed-subject-type",
  "title": "Removed subject type",
  "description": "Pins strict handling of a field removed from the pre-v1 descriptor vocabulary.",
  "subject_type": "topic",
  "sources": [
    {
      "id": "SRC-000001",
      "type": "url",
      "uri": "https://docs.example.com/a/"
    }
  ],
  "sections": [
    {
      "id": "SEC-000001",
      "title": "Root",
      "description": "The only section.",
      "content_uri": "root.md",
      "source_ids": ["SRC-000001"]
    }
  ]
}
