{
  "$schema": "https://schema.openakb.org/v1/openakb.schema.json",
  "id": "minimal-akb",
  "title": "Minimal AKB",
  "description": "The smallest valid OpenAKB descriptor: one content section grounded in one source.",
  "sources": [
    {
      "id": "SRC-000001",
      "type": "url",
      "uri": "https://docs.example.com/minimal/"
    }
  ],
  "sections": [
    {
      "id": "SEC-000001",
      "title": "Overview",
      "description": "A single content section with the required source citation.",
      "content_uri": "sections/overview.md",
      "source_ids": ["SRC-000001"]
    }
  ]
}
