{
  "$schema": "https://schema.openakb.org/v1/openakb.schema.json",
  "id": "valid-forest",
  "title": "Valid — forest",
  "description": "Two roots plus a container with a child; exercises the acyclic forest shape.",
  "sources": [
    {
      "id": "SRC-000001",
      "type": "url",
      "uri": "https://docs.example.com/a/"
    }
  ],
  "sections": [
    {
      "id": "SEC-000001",
      "title": "Root A",
      "description": "First root; a pure container."
    },
    {
      "id": "SEC-000002",
      "parent_id": "SEC-000001",
      "title": "Child A",
      "description": "Child of root A.",
      "content_uri": "a.md",
      "source_ids": ["SRC-000001"]
    },
    {
      "id": "SEC-000003",
      "title": "Root B",
      "description": "Second root with content.",
      "content_uri": "b.md",
      "source_ids": ["SRC-000001"]
    }
  ]
}
