{
  "$schema": "https://schema.openakb.org/v1/openakb.schema.json",
  "namespace": "example",
  "id": "widget-api",
  "title": "Widget API",
  "description": "A sample AKB whose section carries a claim-level provenance sidecar.",
  "language": "en",
  "sources": [
    {
      "id": "SRC-000001",
      "type": "url",
      "uri": "https://docs.example.com/widget-api/",
      "captured_at": "2026-06-30T00:00:00Z"
    }
  ],
  "sections": [
    {
      "id": "SEC-000001",
      "title": "API",
      "description": "The public request/response contract, with per-claim provenance.",
      "content_uri": "sections/api.md",
      "content_type": "text/markdown",
      "source_ids": ["SRC-000001"],
      "provenance_uri": "sections/api.prov.json"
    }
  ]
}
